id,text,theme_id,theme,author,author_title,comment_url,likes,replies,sentiment,idea_strength_seed
7369229855193747456,"This is great. I will commit to training and empowering AI education to Saudi with our Ai social platform utilizing Humain, particularly thru our education side we call STREAM to help push Saudi excellence. Every part of the world should be doing this and this is great leadership.",8,ai / saudi / humain,Adel Belgaied,CEO of PIVIT | All-In-One - AI Social Media AuthentIQ Intelligence | Your Brain - Your Algorithm,https://www.linkedin.com/feed/update/urn:li:activity:7369227868972691457?commentUrn=urn%3Ali%3Acomment%3A%28activity%3A7369227868972691457%2C7369229855193747456%29&dashCommentUrn=urn%3Ali%3Afsd_comment%3A%287369229855193747456%2Curn%3Ali%3Aactivity%3A7369227868972691457%29,0,3,0.45,9.7875
7369233271202664449,"Inspiring vision, Tareq — count me in. To make Hunain Academy uniquely practical from day one, I’d prioritize three pillars: Arabic-first LLM/RAG with PDPL/NDMO by design — evaluation harness (quality, latency, safety), red-teaming, and governance baked in. Production-grade LLMOps — vLLM/Triton serving, CI/CD for models & prompts, observability (metrics/traces/logs), and clear SLOs. AI FinOps — cost-per-token visibility, GPU utilization targets, caching/quantization playbooks to scale efficiently. #HunainAcademy #HumainAI #Vision2030 #AIUpskilling #TheEndOfLimits",5,ai / academy / real,Sultan Albuqami,"PMO & Program Delivery | BCM/DR & Compliance | Governance & Controls | Telecom & Infra | PMP®, PMI-RMP® | Bilingual (AR/EN) | Riyadh, KSA",https://www.linkedin.com/feed/update/urn:li:activity:7369227868972691457?commentUrn=urn%3Ali%3Acomment%3A%28activity%3A7369227868972691457%2C7369233271202664449%29&dashCommentUrn=urn%3Ali%3Afsd_comment%3A%287369233271202664449%2Curn%3Ali%3Aactivity%3A7369227868972691457%29,0,0,0.325,0.0
7369234100475301888,"1. Work back form the customer problem... not tech out. The goal is not to do AI.. its to solve problems and make the world better 2. The training should focus on the world ""in front of the model.. not behind the model"". 3. I'd go with three levels. Foundation (for all), Generalist (Reaching for AI in a practical way), and Specialist (as part of a AI project with budget) 4. Give them a tool kit with support to take away to stay connected to Humain 5. Pick the best candidates ambassadors program 6 Student outreach can lean towards the world behind the model and PHD research / talent scouting. For general students provide access to learn / grow / up-skill",7,ai / real / training,Gavin Payne,"Chief Digital Officer | AI, Design, Innovation, Creativity",https://www.linkedin.com/feed/update/urn:li:activity:7369227868972691457?commentUrn=urn%3Ali%3Acomment%3A%28activity%3A7369227868972691457%2C7369234100475301888%29&dashCommentUrn=urn%3Ali%3Afsd_comment%3A%287369234100475301888%2Curn%3Ali%3Aactivity%3A7369227868972691457%29,0,5,0.22499999999999998,13.78125
7369237264830263297,"Tareq Amin Just completed Stanford’s Post Grad Certificate in AI and ML - the theory is world-class but what’s missing is the 0-to-1 journey. How to choose between GPT-5, Claude, Gemini or now HUMAIN for YOUR specific use case. How to handle edge cases when your users aren’t typical (at Futuroos, we’re building AI-powered behavioral assessment for 5-9 year olds that predicts career aptitudes through gameplay and learn from it as well - try explaining that to traditional ML approaches). How to optimize costs without sacrificing quality when you need real-time inference. My ideal AI learning path: Start with a real problem, ship something in week 1, iterate with actual user feedback, THEN understand why it works. Theory should support building, not precede it. Would love to see Hunain Academy focus on ‘AI in production’ - dealing with rate limits, handling hallucinations, building guardrails for sensitive use cases (essential when your AI assesses children’s potential). The messy stuff that actually determines if your product succeeds. Saudi needs builders who can ship, not just prototype. This is exactly the right vision 🚀",4,ai / tareq / tareq amin,Ahmed Ashraf,GRC & Enterprise Risk Services - Business Resilience at MNP | CBCP | McGill MBA | CSM® | CSPO® | Military Veteran | ACSA® | Trained Leader and An Avid Problem Solver,https://www.linkedin.com/feed/update/urn:li:activity:7369227868972691457?commentUrn=urn%3Ali%3Acomment%3A%28activity%3A7369227868972691457%2C7369237264830263297%29&dashCommentUrn=urn%3Ali%3Afsd_comment%3A%287369237264830263297%2Curn%3Ali%3Aactivity%3A7369227868972691457%29,0,3,0.1480654761904762,7.749441964285715
7369238195223367680,"This is a truly visionary initiative. Hunain Academy can address a critical gap—developing talent that is not only certified, but capable of delivering measurable impact. Academc training must be progressive, balanced, and multidimensional—integrating skills, knowledge, and experience as complementary pillars. Motivation to learn is a spark; without structure, it fades. The Academy can turn that spark into a sustainable flame by meeting learners at different entry points and guiding them through well-designed stages. Global best practices, the NICE Framework, emphasize aligning skill, knowledge, and competency with industry outcomes. In this context, Hunain Academy should put learner motivation at the center—a higher priority than filtering or testing. Challenges should serve as enablers, introduced purposefully to reinforce learning or validate readiness, never at the cost of discouragement. Sustaining motivation first ensures lasting engagement, stronger performance, and real employability. Ultimately, the true benchmark is not certification, but the ability to apply skills with efficiency, confidence, and impact. Hunain Academy has the opportunity to set that benchmark—not only for Saudi Arabia, but for the wider region.",5,ai / academy / real,Nawwaf Alabdulhadi,Cybersecurity Strategist | National Ecosystem & Digital Architecture Leader | Regulatory Frameworks & Digital Transformation | Program Orchestration | Harvard | CMU | U.S. Patent Holder,https://www.linkedin.com/feed/update/urn:li:activity:7369227868972691457?commentUrn=urn%3Ali%3Acomment%3A%28activity%3A7369227868972691457%2C7369238195223367680%29&dashCommentUrn=urn%3Ali%3Afsd_comment%3A%287369238195223367680%2Curn%3Ali%3Aactivity%3A7369227868972691457%29,0,0,0.20357142857142857,0.0
7369238200994713602,"Thank you for sharing this in public. I think there is something happening in the background and we should focus on, and that is how to run the Data Centers that will host the AI processing sustainaby? Thanks again !",0,ai / training / humain,Ali Nasser,PMP® | Ph.D. Candidate in Electrical Engineering | Sustainable Energy for Data Centers | Tau Beta Pi Honor Member,https://www.linkedin.com/feed/update/urn:li:activity:7369227868972691457?commentUrn=urn%3Ali%3Acomment%3A%28activity%3A7369227868972691457%2C7369238200994713602%29&dashCommentUrn=urn%3Ali%3Afsd_comment%3A%287369238200994713602%2Curn%3Ali%3Aactivity%3A7369227868972691457%29,0,0,0.125,0.0
7369238913195913216,"What a brilliant idea Tareq Amin as I was thinking about the value of this initiative since lunching of Humain. I think it can be distinguished by becoming a Pro-Social AI hub that blends local priorities with global best practices, combining hands-on skills, ethics and governance, and Arabic-focused innovation. It should focus on AI professionals who are technically competent and also human-oriented builders and globally aware leaders and able to create measurable social and economic impact. Some practical applications I suggest to emphasize: 1. Pro-Social AI projects tackling real social challenges. 2. Replacing certificates with impact-based outcomes. 3. Creating an AI-to-startup accelerator pipeline.",2,ai / tareq / amin,Prof. Ahmed Al Khateeb,"Sr. Advisor | Agile Leadership | Governance | Public Policy | EdTech | Inspiring Innovation with Upholding Ethics, Human-Centered Values, and Social Impact | Digital Wellbeing",https://www.linkedin.com/feed/update/urn:li:activity:7369227868972691457?commentUrn=urn%3Ali%3Acomment%3A%28activity%3A7369227868972691457%2C7369238913195913216%29&dashCommentUrn=urn%3Ali%3Afsd_comment%3A%287369238913195913216%2Curn%3Ali%3Aactivity%3A7369227868972691457%29,0,2,0.353030303030303,6.088636363636363
7369239910765002756,"Academy is a must ,but I think basically to start with 3 complete courses should be prepared that include:1.Students in Schools and Universities. 2.Governmental employees.3.Private sector. These courses will introduce AI and how to deploy it to be intergarted with the exsisted system, that will lead us how to benefit from AI in each field for better output.",4,ai / tareq / tareq amin,Mohannad Abbas Haddadin,"CEO at Jobkins Enterprises. Partner @ PointZero App. GM at Jobkins Centre For Strategic Studies. Consultant at CDAG-DDL Group. Expert and Strategic Analyst in the Politics, Economics, Technology,Security,Finance.",https://www.linkedin.com/feed/update/urn:li:activity:7369227868972691457?commentUrn=urn%3Ali%3Acomment%3A%28activity%3A7369227868972691457%2C7369239910765002756%29&dashCommentUrn=urn%3Ali%3Afsd_comment%3A%287369239910765002756%2Curn%3Ali%3Aactivity%3A7369227868972691457%29,0,0,0.3,0.0
7369241106997309443,"This is a fantastic initiative. The vision for Humain Academy feels very timely and much needed in the region. From my own experience working on AI use cases in healthcare and telecom, one of the biggest gaps I’ve noticed is the bridge between theoretical knowledge and practical, enterprise-ready implementation. Learners often understand concepts but struggle to apply them in real-world, industry-grade scenarios. I’d suggest focusing on: Hands-on labs where learners can build and deploy AI models on real datasets. End-to-end projects (from data preparation to deployment & monitoring) to simulate the true lifecycle of AI solutions. Domain-focused tracks (healthcare, finance, telecom, government) so participants see immediate relevance to their industries. Agentic AI and LLMOps as these are the future of scalable, enterprise adoption. If Humain Academy can deliver training that produces not just AI enthusiasts, but AI practitioners ready to contribute from day one, it will be a remarkable achievement for Saudi and the region. Happy to collaborate or share insights from the projects I’ve been working on.",5,ai / academy / real,Mohammad Naushad,Data | AI | Generative AI | Agentic AI | Lang chain | Lang Graph | Author | Enterprise Architect | Solution Architect | Digital Transformation | Cloud Solutions,https://www.linkedin.com/feed/update/urn:li:activity:7369227868972691457?commentUrn=urn%3Ali%3Acomment%3A%28activity%3A7369227868972691457%2C7369241106997309443%29&dashCommentUrn=urn%3Ali%3Afsd_comment%3A%287369241106997309443%2Curn%3Ali%3Aactivity%3A7369227868972691457%29,0,0,0.33636363636363636,0.0
7369242739667857410,"Tareq Amin The way I see it, AI training should start with business outcomes, not tools. Define a clear goal—like cutting support costs or boosting sales—and then design the learning backward so learners actually build AI solutions that deliver those outcomes.",4,ai / tareq / tareq amin,"Hussam Alharbi, CME-1, C-KPI",KPI & Process Optimization Infused with AI,https://www.linkedin.com/feed/update/urn:li:activity:7369227868972691457?commentUrn=urn%3Ali%3Acomment%3A%28activity%3A7369227868972691457%2C7369242739667857410%29&dashCommentUrn=urn%3Ali%3Afsd_comment%3A%287369242739667857410%2Curn%3Ali%3Aactivity%3A7369227868972691457%29,0,0,-0.16666666666666666,0.0
7369243120296710145,"Great Initiatives, I would say that there is common AI training which build the baseline for all industries, however specialized training per industry would be essential. and not only the AI / IT Experiences, but the Industries experience as a good mix. The industries are listed below, and can be prioritized based on Saudi Market, and Business Trends: So AI Training vision should fit the following industries (47+): 1. Agriculture 2. Aerospace 3. Automotive 4. Biotechnology 5. Chemicals 6. Construction 7. Consumer Goods 8. Defense 9. Education 10. Electronics 11. Energy 12. Entertainment 13. Environmental Services 14. Fashion 15. Financial Services 16. Food & Beverage 17. Forestry 18. Government 19. Healthcare 20. Hospitality 21. Information Technology 22. Insurance 23. Legal Services 24. Logistics 25. Manufacturing 26. Marine 27. Media 28. Mining 29. Non-Profit 30. Oil & Gas 31. Pharmaceuticals 32. Publishing 33. Real Estate 34. Retail 35. Software 36. Sports 37. Telecommunications 38. Tourism 39. Transportation 40. Utilities 41. Waste Management 42. Wholesale 43. Robotics 44. Artificial Intelligence (The baseline) 45. Cybersecurity 46. Data Analytics 47. Research & Development",7,ai / real / training,Hesham Sewaify,"Global Strategic Accounts & Sales Leader at Emerson Automation Solutions | BSc in Electrical Engineering | Industrial Expert Oil & Gas, Petrochemicals, and diverse market in KSA and GCC",https://www.linkedin.com/feed/update/urn:li:activity:7369227868972691457?commentUrn=urn%3Ali%3Acomment%3A%28activity%3A7369227868972691457%2C7369243120296710145%29&dashCommentUrn=urn%3Ali%3Afsd_comment%3A%287369243120296710145%2Curn%3Ali%3Aactivity%3A7369227868972691457%29,0,0,0.10000000000000002,0.0
7369245296058384385,"AI training is significantly different from other types of technology training. It requires a fundamental shift in mindset. Therefore, proper training should not only focus on the technical aspects of AI but must also extend beyond technology. Who would create the demand for AI services and products? Business people. However, if they don't understand AI (not in a technical sense, but in terms of value creation), then there won't be sufficient demand for the AI supply that Saudi Arabia is investing in. An AI academy should have multiple paths: executive, business (non-technical), and technical. I see this challenge of the disconnect between business professionals and technical professionals daily.",6,ai / saudi / real,Mohammed Alqarni,AI-for-Business Consultant | Helping enterprises realize value and unlock growth with AI,https://www.linkedin.com/feed/update/urn:li:activity:7369227868972691457?commentUrn=urn%3Ali%3Acomment%3A%28activity%3A7369227868972691457%2C7369245296058384385%29&dashCommentUrn=urn%3Ali%3Afsd_comment%3A%287369245296058384385%2Curn%3Ali%3Aactivity%3A7369227868972691457%29,0,0,-0.0125,0.0
7369246054367547394,"Hi Tareq, first of all congratulations on the launch of Humain platform, a Leap of faith, a brand new milestone for the Arab world. This will allow for so many talented Arab speaking people to manifest their hidden Talents & innovate. launching Humain Academy is a brilliant idea, moreover, I believe that the academy should align with local educational system to guide & prepare Students in the Right approach & to be fully ready for the AI world. Observing the helthcare system in KSA, It faces many challenges, leveraging AI Will allow for faster & more accurate diagnosis, disease detection systems, Streamlined data integration & unified records & much more Hamain academy, will play a pivotal role in educating & preparing talents to address the various challenges across The various disciplines.",8,ai / saudi / humain,Taymour Ismail,"CEO /founder AI TECH, Embarking On a new chapter, the dynamic world of artificial intelligence & advanced technologies. Saudi Arabia’s vision 2030",https://www.linkedin.com/feed/update/urn:li:activity:7369227868972691457?commentUrn=urn%3Ali%3Acomment%3A%28activity%3A7369227868972691457%2C7369246054367547394%29&dashCommentUrn=urn%3Ali%3Afsd_comment%3A%287369246054367547394%2Curn%3Ali%3Aactivity%3A7369227868972691457%29,0,0,0.32090654443595623,0.0
7369249919980687361,"Tareq Amin This is truly an inspiring initiative. In my view, the success of AI in any organization or society depends on public trust and awareness. Except for a small group of experts, most people still perceive AI as a mystery rather than a tool designed to augment human productivity and improve quality of life. HUMAIN is all about enhancing public living via AI. 1# What needed to be Focused as asked? There is a strong need to prioritize AI awareness and digital dexterity. Not everyone in enterprises or corporations is digitally fluent, so training should ensure professionals can confidently adopt AI as a partner aligned with organizational goals—not as a replacement for human talent. (1)",4,ai / tareq / tareq amin,Muhammad Irfan Raza (MBA),"Freelance Tech Analyst – AI, IoT, and Emerging Technologies",https://www.linkedin.com/feed/update/urn:li:activity:7369227868972691457?commentUrn=urn%3Ali%3Acomment%3A%28activity%3A7369227868972691457%2C7369249919980687361%29&dashCommentUrn=urn%3Ali%3Afsd_comment%3A%287369249919980687361%2Curn%3Ali%3Aactivity%3A7369227868972691457%29,0,1,0.16527777777777777,2.621875
7369250402409664512,"I think the main focus should be on real, hands-on skills that people can actually use in their jobs. A lot of AI training today stays very theoretical, but what’s really needed is the chance to work directly with tools, data, and real-life projects. If the academy can bridge that gap between what’s taught in classrooms and what companies in Saudi really need—whether in finance, healthcare, energy, or even government—it will make a big difference. At the end of the day, people want to come out of a program not just with a certificate, but with the confidence that they can build and deploy something useful in the real world.",6,ai / saudi / real,Hussam J. Kilani,Digital Transformation | Lead Business Analyst | Product Management,https://www.linkedin.com/feed/update/urn:li:activity:7369227868972691457?commentUrn=urn%3Ali%3Acomment%3A%28activity%3A7369227868972691457%2C7369250402409664512%29&dashCommentUrn=urn%3Ali%3Afsd_comment%3A%287369250402409664512%2Curn%3Ali%3Aactivity%3A7369227868972691457%29,0,0,0.13666666666666666,0.0
7369251010550095876,Khobar also deserves a chance.. We should not forget that the #1 university in the world #KFUPM is located in Dahran 😁👌,8,ai / saudi / humain,Eng. Ramzi AlJunaidi,Senior Executive | Strategy & Transformation Leader | Driving Growth Beyond the Energy Sector,https://www.linkedin.com/feed/update/urn:li:activity:7369227868972691457?commentUrn=urn%3Ali%3Acomment%3A%28activity%3A7369227868972691457%2C7369251010550095876%29&dashCommentUrn=urn%3Ali%3Afsd_comment%3A%287369251010550095876%2Curn%3Ali%3Aactivity%3A7369227868972691457%29,0,2,0.0,4.5
7369251493759193088,"Tareq Amin you should connect with Dr. Michel A. Khoury . He is reshaping academia by training the next generation in real world skills, including AI, and transforming education in both physical classrooms and online. His work will impact the MENA region and beyond. Good luck!",2,ai / tareq / amin,Tarek Itani,Executive Vice Chairman,https://www.linkedin.com/feed/update/urn:li:activity:7369227868972691457?commentUrn=urn%3Ali%3Acomment%3A%28activity%3A7369227868972691457%2C7369251493759193088%29&dashCommentUrn=urn%3Ali%3Afsd_comment%3A%287369251493759193088%2Curn%3Ali%3Aactivity%3A7369227868972691457%29,0,0,0.26875,0.0
7369251685363314691,"I witnessed similar excellent academies and training in Abu Dhabi. One comment I would have is to make HUMAIN Academy as human as possible, drawing on students from diverse backgrounds, ages, socioeconomics, nationalities, neurodivergent. Better input should result in superior output.",8,ai / saudi / humain,Scott Birch,Associate Director – Content Strategy at Red Sea Global,https://www.linkedin.com/feed/update/urn:li:activity:7369227868972691457?commentUrn=urn%3Ali%3Acomment%3A%28activity%3A7369227868972691457%2C7369251685363314691%29&dashCommentUrn=urn%3Ali%3Afsd_comment%3A%287369251685363314691%2Curn%3Ali%3Aactivity%3A7369227868972691457%29,0,0,0.3666666666666667,0.0
7369252025101971456,"Hi Tareq Amin— love this direction. My crisp take: >Prioritise: Arabic-first AI (MSA + dialects), production readiness (LLMOps, evals, safety), and enterprise integration (RAG/RAA with real systems, data residency). >Fix what’s missing: A measurement culture (quality/latency/cost/safety), vendor-neutral fluency, and learners graduating with a shipped mini-product, not just a certificate. >8-week path: Foundations & safety → Build & evaluate → Integrate & optimize → Operate & govern → Sector capstone (Saudi use case).",2,ai / tareq / amin,Amit Pandey,Principal Product Manager @ Microsoft | Building Agentic AI & Copilot Experiences | Customer-Obsessed Innovator,https://www.linkedin.com/feed/update/urn:li:activity:7369227868972691457?commentUrn=urn%3Ali%3Acomment%3A%28activity%3A7369227868972691457%2C7369252025101971456%29&dashCommentUrn=urn%3Ali%3Afsd_comment%3A%287369252025101971456%2Curn%3Ali%3Aactivity%3A7369227868972691457%29,0,0,0.1875,0.0
7369252405869281285,"An academy should produce qualified resources to tackle real life concerns. There should be real life solutions in the following domains: Agriculture (agrobots etc) Manufacturing (arm robots) Healthcare Education Insurance and banking Entertainment We need to stop old fashioned methods of data entry systems and use AI to elevate the human daily interaction. Humain can put Riyadh on the top tech cities of the world map, and a well designed academy could be the Oxford of Saudi Arabia.",6,ai / saudi / real,Rami N.,GCC Cloud and AI,https://www.linkedin.com/feed/update/urn:li:activity:7369227868972691457?commentUrn=urn%3Ali%3Acomment%3A%28activity%3A7369227868972691457%2C7369252405869281285%29&dashCommentUrn=urn%3Ali%3Afsd_comment%3A%287369252405869281285%2Curn%3Ali%3Aactivity%3A7369227868972691457%29,0,0,0.14285714285714285,0.0
7369254297915547649,"When designing AI training programs, a few principles are essential: • Inclusive by design: programs should meet the needs of all employees, from entry-level to top management. • Flexible in depth and duration: ranging from short orientations to multi-month deep learning tracks. • Holistic in scope: covering AI development and enhancement, usability and application, as well as risk, control, and governance. • Sector-specific: tailored programs for industries such as healthcare, smart cities, cybersecurity, and law — enabling professionals to apply AI in their fields and feed back insights into better use cases. Training done right becomes more than a skill-building exercise — it becomes a driver of responsible AI adoption and sustainable growth. (Drafted in my own words, with AI support rewarding — a small example of human–AI collaboration in action.)",7,ai / real / training,Mohammed Alomari,"Director Cybersecurity / Privacy / Risk Management / Corporate Governance, Audit and Compliance , EMBA, CISSP",https://www.linkedin.com/feed/update/urn:li:activity:7369227868972691457?commentUrn=urn%3Ali%3Acomment%3A%28activity%3A7369227868972691457%2C7369254297915547649%29&dashCommentUrn=urn%3Ali%3Afsd_comment%3A%287369254297915547649%2Curn%3Ali%3Aactivity%3A7369227868972691457%29,0,0,0.18437499999999998,0.0
7369254497052721153,Mr. CEO let's discuss few ideas to make the academy a success. heshammoubarak72@gmail.com,10,academy / initiative / humain,Hesham Moubarak,Senior Principal Geophysicist | AI & ML Innovator in Seismic Interpretation | Expert in Reservoir Optimization & Energy Transition | University Lecturer | 20+ Years of Global Leadership,https://www.linkedin.com/feed/update/urn:li:activity:7369227868972691457?commentUrn=urn%3Ali%3Acomment%3A%28activity%3A7369227868972691457%2C7369254497052721153%29&dashCommentUrn=urn%3Ali%3Afsd_comment%3A%287369254497052721153%2Curn%3Ali%3Aactivity%3A7369227868972691457%29,0,0,0.04999999999999999,0.0
7369256339178418176,"Hi Mr Tareq Indeed, this will help the people to understand AI I suggest the following from my experience Create two portfolios for education 1- Technical, focus on computer vision, which will lead to the realisation of very important projects in KSA 2- Strategic, this is a very critical and important area because every single company wants to implement AI but does not know how, and then fails at this stage, and many projects fail at this stage after investing money, time and effort, and are then out of the AI race.",4,ai / tareq / tareq amin,Younis Arrabi - MSc (AI),PhD Researcher in Artificial Intelligence | Specializing in AI Applications for Telecommunications | AI Computer Vision | Data Analytics | BI Specialist | EXCEL Expert,https://www.linkedin.com/feed/update/urn:li:activity:7369227868972691457?commentUrn=urn%3Ali%3Acomment%3A%28activity%3A7369227868972691457%2C7369256339178418176%29&dashCommentUrn=urn%3Ali%3Afsd_comment%3A%287369256339178418176%2Curn%3Ali%3Aactivity%3A7369227868972691457%29,0,0,0.05485714285714287,0.0
