id,text,theme_id,theme,author,author_title,comment_url,likes,replies,sentiment,idea_strength_seed
7369257032236834817,"1 thing that needs to be baked into this is CONTINUOUS LEARNING. Even for folks who work in AI daily, have struggled to keep up so you can only imagine how folks who are not interacting with AI. - Some mechanism to encourage daily use. Gamification helps but it really happens when people are incentivised and appraised. - Learning should not be limited to theory, people need to be given means to practice. A dedicated small learning budget (e.g. everyone gets SAR2000 per year) - An internal ""incubator"" that oversees some of these practical ideas and scales it deep and wide. This is where I saw IMPACT when I was running AI projects for marketing worth $1.6B at Google Hope this helps",0,ai / training / humain,Danish B.,"Ex-Google, AI and Marketing Consultant. I transform businesses and professionals with AI literacy",https://www.linkedin.com/feed/update/urn:li:activity:7369227868972691457?commentUrn=urn%3Ali%3Acomment%3A%28activity%3A7369227868972691457%2C7369257032236834817%29&dashCommentUrn=urn%3Ali%3Afsd_comment%3A%287369257032236834817%2Curn%3Ali%3Aactivity%3A7369227868972691457%29,0,0,0.007857142857142858,0.0
7369257497032957954,"🚀 This is such an exciting initiative! Congratulations on shaping a vision that truly rethinks how AI training should be delivered in Saudi and the wider region. From our experience, this is what resonates most: 1. Build tracks for priority sectors in Saudi Vision 2030 (energy, finance, healthcare, logistics, construction) 2. Bridging leadership & strategy with AI adoption — AI + Leadership & Change Management - Most AI programs focus on tools; very few prepare leaders to drive adoption, manage AI ethics, and align AI with business strategy. 3. Entrepreneurship & AI for Startups - Offer a track that empowers entrepreneurs to build AI-powered businesses, pitch investors, and deploy MVPs. - This fills a gap as most AI training ignores the startup ecosystem in Saudi. Most importantly, what’s missing today is training rarely addresses AI implementation barriers: change management, culture, and workforce adoption. Building on the leadership and behavioral change it’s a win. Looking forward to seeing HUMAIN Academy become a benchmark for practical, future-ready AI talent development in Saudi Arabia. 👏",6,ai / saudi / real,Lule Bunjaku Karapinar,VP - Executive Education at LEORON Institute,https://www.linkedin.com/feed/update/urn:li:activity:7369227868972691457?commentUrn=urn%3Ali%3Acomment%3A%28activity%3A7369227868972691457%2C7369257497032957954%29&dashCommentUrn=urn%3Ali%3Afsd_comment%3A%287369257497032957954%2Curn%3Ali%3Aactivity%3A7369227868972691457%29,0,0,0.3104545454545455,0.0
7369257808103407618,The Academy goal should be improving Human Experience in all aspects of life not only in businesses.,10,academy / initiative / humain,Hamdi Al-Amawi,"Human Experience Practitioner, MBA, Doctoral Researcher, Co-author of ""Customer Experience 5 "" ، CX Awards Judge",https://www.linkedin.com/feed/update/urn:li:activity:7369227868972691457?commentUrn=urn%3Ali%3Acomment%3A%28activity%3A7369227868972691457%2C7369257808103407618%29&dashCommentUrn=urn%3Ali%3Afsd_comment%3A%287369257808103407618%2Curn%3Ali%3Aactivity%3A7369227868972691457%29,0,0,0.0,0.0
7369258037397622786,"What areas do you believe we should focus on most? Tareq Amin, below one input: In mission-critical enterprise processes, the challenge is to ensure that the outcomes of ML, GenAI, and agentic systems are as reliable and explainable as those produced by deterministic systems, while still meeting the expectations for superior value offered by the former.",3,ai / training / skills,Matteo Gatta,CEO | CRO | SaaS & CPaaS Transformation | $1B+ Global P&L | Telco & Tech | Profitable Growth | Board Experience,https://www.linkedin.com/feed/update/urn:li:activity:7369227868972691457?commentUrn=urn%3Ali%3Acomment%3A%28activity%3A7369227868972691457%2C7369258037397622786%29&dashCommentUrn=urn%3Ali%3Afsd_comment%3A%287369258037397622786%2Curn%3Ali%3Aactivity%3A7369227868972691457%29,0,0,0.39999999999999997,0.0
7369260211892613121,"Enabling Marketers on utilizing AI is vital. Young Marketers should focus on driving strategies, Tactics, Analytics & User Behavior Cohorts, Content Creation,& integrated campaign planning. I am happy to contribute to this Academy, As a caliber who have been relying on AI in day to day Marketing OPS",0,ai / training / humain,Basem Mohsen,🚀 Regional Marketing & GTM Leader | SaaS & Fintech Growth | Digital & Brand Strategy | Demand Generation | Performance Marketing,https://www.linkedin.com/feed/update/urn:li:activity:7369227868972691457?commentUrn=urn%3Ali%3Acomment%3A%28activity%3A7369227868972691457%2C7369260211892613121%29&dashCommentUrn=urn%3Ali%3Afsd_comment%3A%287369260211892613121%2Curn%3Ali%3Aactivity%3A7369227868972691457%29,0,0,0.3333333333333333,0.0
7369260669176598531,"I believe the main focus should be on: Hands-on learning with real AI tools and platforms – enabling learners to work directly in practical environments rather than just theory. Real-world projects and business cases – designing programs that mirror the challenges of Saudi and global companies, preparing learners to solve actual problems. Bridging theory and practice – ensuring students grasp AI fundamentals in ways that can be directly applied in the workplace. Entrepreneurship and innovation – empowering learners to develop scalable, executable AI solutions and products. Advanced skill development – including machine learning, deep learning, data analytics, and natural language processing, with a strong focus on practical applicability. Focusing on these areas will position HUMAIN Academy as a leading platform that closes the gap between academic learning and real market needs.",6,ai / saudi / real,Ashraf AL-Tarawneh .,"Sr. Digital Transformation & Strategy Advisor | TOGAF, CDMP, ISMS, BCMS, CISSP, CISA, PMP, BSC, GDPR, CEH, COBIT, ISO 56000, ITSM, CCBA, CDBA, CMMI, Strategic Planning, Innovation Management, Agile, Business Analysis",https://www.linkedin.com/feed/update/urn:li:activity:7369227868972691457?commentUrn=urn%3Ali%3Acomment%3A%28activity%3A7369227868972691457%2C7369260669176598531%29&dashCommentUrn=urn%3Ali%3Afsd_comment%3A%287369260669176598531%2Curn%3Ali%3Aactivity%3A7369227868972691457%29,0,0,0.14166666666666666,0.0
7369261779467554816,"Great initiative 👏 Excited to see this take shape. A few areas I’d recommend: AI for productivity: Practical skills in prompt coding & everyday efficiency. Hackathons: Driving innovation by solving real challenges in the Kingdom. AI in research: Promoting responsible use and helping young researchers understand local regulations on AI use in research and avoid any unintentional ""plagiarism"". This could really accelerate AI talent development in Saudi Arabia!",6,ai / saudi / real,Ashraf A.,"Expert in Risk & Compliance | Strategic Planning | R&D Governance | Energy & Sustainability | Data-Driven Decision-Making | DBA, PMP, PMI-RMP, CCEP-I, CMRP",https://www.linkedin.com/feed/update/urn:li:activity:7369227868972691457?commentUrn=urn%3Ali%3Acomment%3A%28activity%3A7369227868972691457%2C7369261779467554816%29&dashCommentUrn=urn%3Ali%3Afsd_comment%3A%287369261779467554816%2Curn%3Ali%3Aactivity%3A7369227868972691457%29,0,0,0.16944444444444445,0.0
7369262911740964864,"The gap you’re addressing is exactly where transformation either succeeds or stalls. In Saudi Arabia we’ve seen AI training stay stuck in theory while organizations struggle to find talent ready to deliver impact on the ground. Real world immersion on actual AI platforms must be the default not the exception. Sector specific problem solving spanning critical areas such as energy, industry, education, government, healthcare, public services, and emerging technologies should be the proving ground. And beyond technical fluency, we need to cultivate leaders who can deploy and scale AI responsibly at national level. An academy built this way won’t just upskill talent, it will shape the country’s AI operating model for the next decade. That’s the bar HUMAIN Academy should set.",6,ai / saudi / real,Dr. Alaa Alsaif,"Head of Knowledge Events, SDAIA | PhD | AI & Digital Transformation Leader Driving Global Programs & Capability Building Expert.",https://www.linkedin.com/feed/update/urn:li:activity:7369227868972691457?commentUrn=urn%3Ali%3Acomment%3A%28activity%3A7369227868972691457%2C7369262911740964864%29&dashCommentUrn=urn%3Ali%3Afsd_comment%3A%287369262911740964864%2Curn%3Ali%3Aactivity%3A7369227868972691457%29,0,0,0.12916666666666665,0.0
7369263098232258560,"Tareq Amin it is a great initiative and from my prospective there are three areas HUMAIN Academy could truly differentiate itself 1️) AI as a Tool, Not a Goal Most training today treats AI as an end in itself. The academy should frame AI as an enabler—something to be applied to real business, social, and entrepreneurial challenges. This mindset shift will make your graduates stand out. 2️) Hands-On, Project-Based Learning Instead of just teaching how models work, let participants build, deploy, and scale solutions with real datasets, real platforms and real constraints (cost, compliance, ethics). Employers value this readiness. 3️) Bridging Ecosystems Create tracks not only for students and professionals, but also for SMEs, startups, and government entities. A big gap in the region today is practical AI skills that are aligned with Vision 2030 priorities (healthcare, logistics, fintech, cybersecurity, sustainability). HUMAIN Academy can become that bridge.",4,ai / tareq / tareq amin,Amr El-Zidy,Regional Representative - Business Development Management - Channel Management - Customer Success Management - Innovation Management - Technology Awareness - Business Consultant - Operation Consultant,https://www.linkedin.com/feed/update/urn:li:activity:7369227868972691457?commentUrn=urn%3Ali%3Acomment%3A%28activity%3A7369227868972691457%2C7369263098232258560%29&dashCommentUrn=urn%3Ali%3Afsd_comment%3A%287369263098232258560%2Curn%3Ali%3Aactivity%3A7369227868972691457%29,0,0,0.23703703703703705,0.0
7369263731337256961,"That's a great step forward and will answer your questions, but I also have a question for you 👉 What areas do you believe we should focus on most? 1. Critical Thinking (currently, we are becoming so dependent on AI that we no longer think, let alone critically think) 2. Effective Communication (using different communication analysis tools) 👉 What’s missing from AI training today that HUMAIN Academy can solve? 1. Training accessibility (right now, every training is becoming expensive for no reason, and it limits reach) 2. Lack of practicality (most training sessions focuses on theory and best case scenario, I want more rainy day scenarios) 👉 If you had to design your ideal AI learning path, what would it look like? My ideal path would be as follows 1. Practical first hand experience (learning through trial and error) 2. Original theory and how it developed over time (growth and development) 3. Different systematic approaches to real life scenarios (critical thinking) 4. Decision-making evaluation (strategic thinking) My question to you: As we all know, medicine is good, but too much medicine could damage the body. Does too much AI harm the human-factor in our daily lives?",4,ai / tareq / tareq amin,Mohammad Al-Kudwah,Growth Focus Consultant | People Development // Creating Tools For Success // Life & Mindset Coach,https://www.linkedin.com/feed/update/urn:li:activity:7369227868972691457?commentUrn=urn%3Ali%3Acomment%3A%28activity%3A7369227868972691457%2C7369263731337256961%29&dashCommentUrn=urn%3Ali%3Afsd_comment%3A%287369263731337256961%2Curn%3Ali%3Aactivity%3A7369227868972691457%29,0,0,0.3041005291005291,0.0
7369266216575639553,"Q: What areas do you believe we should focus on most? A: Prioritise technologies that deliver rapid, broad societal impact, begin with generative AI as the primary focus, followed by deep learning and classical machine learning. This sequencing balances immediate applicability with the development of enduring technical foundations. Q: What’s missing from AI training today that HUMAIN Academy can solve? A: Many practitioners lack rigorous mathematical and statistical foundations, which undermines their ability to research, design, and implement robust AI solutions. HUMAIN Academy can close this gap by combining deep theoretical coursework with hands-on, real-world projects that produce verifiable, production-ready skills. Q: If you had to design your ideal AI learning path, what would it look like? A: Pair rigorous fundamentals (math, statistics, core algorithms) with parallel, project-based learning where students build practical AI solutions. Integrate these streams at key milestones to keep learners motivated and ensure theory directly informs real-world design, producing workplace-ready professionals.",4,ai / tareq / tareq amin,Ihsan U.,SME Data Analytics & AI @ elm | PhD in Machine Learning - UNSW | KSA Premium Resident | Generative AI | Forecasting | NV1,https://www.linkedin.com/feed/update/urn:li:activity:7369227868972691457?commentUrn=urn%3Ali%3Acomment%3A%28activity%3A7369227868972691457%2C7369266216575639553%29&dashCommentUrn=urn%3Ali%3Afsd_comment%3A%287369266216575639553%2Curn%3Ali%3Aactivity%3A7369227868972691457%29,0,0,0.15083333333333335,0.0
7369266388122652672,"Suggest to have (1) a set of system design courses. What the world need more is good system engineers that can produce System design for the edge, including ASIC level, modules, solution structure with true focus on ROI at scale, and not stop at lab experiments success. (2) Buisness classes for how to build the idea, paten it, then make buisness out of it. (3) data security and data protection",3,ai / training / skills,Yasser A.,"President, Executive Advisor & Platform Builder | Ex-AWS&Qualcomm VP AI/IoT/Cloud Innovator, Champion of Emerging Markets",https://www.linkedin.com/feed/update/urn:li:activity:7369227868972691457?commentUrn=urn%3Ali%3Acomment%3A%28activity%3A7369227868972691457%2C7369266388122652672%29&dashCommentUrn=urn%3Ali%3Afsd_comment%3A%287369266388122652672%2Curn%3Ali%3Aactivity%3A7369227868972691457%29,0,0,0.46249999999999997,0.0
7369267294994120706,"This is the right move Tareq Amin, it will help us bring the future into the present. I recommend integrating this move into a comprehensive regulatory framework that embeds AI into Education, Training, Practice, Research, Development, and Innovation, across all sectors. Such an approach will not only maximize HUMAIN Academy return on investment but also amplify its overall impact. To this matter, I have drafted a regulatory framework proposal on integrating AI into Health Professions Education, Training, Practice and Research. This proposal has been accepted for presentation at the International Hospital Federation Congress Meeting in Geneva this coming November 10–13. The framework is scalable and adaptable across all sectors. Strategically embedding it into the Academy will accelerate the impact you aim to achieve, while also aligning all regulatory authorities with this forward-looking direction, one that shapes not only the future, but the present as well. Envisioning HUMAIN Academy advancing this transformation across all sectors. Sincere regards and respectful salute to you, Tareq. Hussain",4,ai / tareq / tareq amin,"Hussain Abdullah AlHussain MBBS, FRCPC, MMGMT, CPHQ, GRCP",Secretary General Deputy for Institutional Affairs,https://www.linkedin.com/feed/update/urn:li:activity:7369227868972691457?commentUrn=urn%3Ali%3Acomment%3A%28activity%3A7369227868972691457%2C7369267294994120706%29&dashCommentUrn=urn%3Ali%3Afsd_comment%3A%287369267294994120706%2Curn%3Ali%3Aactivity%3A7369227868972691457%29,0,0,0.10714285714285714,0.0
7369267876152733700,"Excellent idea Eng. Tareq Amin There is a significant gap in the market for practical, outcome-oriented AI based education that develops local talent and supports national digital transformation goals. The Academy should become the preferred platform for developing AI talent in Saudi Arabia by. 1-Practical training in AI for healthcare 2-Bilingual, culturally relevant content. 3-Real projects with local data and use cases. 4-Clear career paths and mentorship.",8,ai / saudi / humain,Faisal Alkhadra,Organizational Excellence | Quality Improvement | well-being | Institutional Excellence | Corporate Governance | Change Management | Risk Management | Accreditation | Policy Development |,https://www.linkedin.com/feed/update/urn:li:activity:7369227868972691457?commentUrn=urn%3Ali%3Acomment%3A%28activity%3A7369227868972691457%2C7369267876152733700%29&dashCommentUrn=urn%3Ali%3Afsd_comment%3A%287369267876152733700%2Curn%3Ali%3Aactivity%3A7369227868972691457%29,0,0,0.29583333333333334,0.0
7369268595119280128,"Tareq, this is a really exciting initiative! I really admire the fact that HUMAIN Academy is the committed to move past theory and certifications - exactly what the market in Saudi (and globally) is missing today. In my view, the biggest gaps in current AI training are: 1️⃣ Lack of practical exposure to real tools, datasets, and deployment scenarios. 2️⃣ Minimal focus on industry use cases - most programs don’t show how AI transforms sectors like fintech, telecom, healthcare, or energy. 3️⃣ The missing layer of entrepreneurship and product-building - how to take an AI idea from prototype to scale. An ideal AI learning path would start with core foundations, but quickly shift into project-based learning, hackathons, and industry-led challenges. Learners should graduate not just with knowledge, but with a portfolio of AI projects they can showcase to employers or investors. I believe HUMAIN Academy has the potential to become the go-to hub for practical AI talent in Saudi and beyond. Count me in to support and collaborate in shaping this vision.",8,ai / saudi / humain,Mohammed Azim Ansari,"Strategy & Excellence @ stc | Ex-IDC, BCG, e& | AI | FinTech | Digital | Tech | Strategy | Consulting | Advisory | Market Research | Analytics | Growth | KSA Vision2030 | Startups | Entrepreneur | Consultant",https://www.linkedin.com/feed/update/urn:li:activity:7369227868972691457?commentUrn=urn%3Ali%3Acomment%3A%28activity%3A7369227868972691457%2C7369268595119280128%29&dashCommentUrn=urn%3Ali%3Afsd_comment%3A%287369268595119280128%2Curn%3Ali%3Aactivity%3A7369227868972691457%29,0,0,0.1544871794871795,0.0
7369269397745528833,"I believe it is essential to train people in Business process management . Many companies still operate on legacy systems, and applying AI directly to them will often result in lack of contextualization and absence of business modeling . This should therefore become a core part of learning and development. Without this , enterprises are likely to see their AI efforts fail.",3,ai / training / skills,Abdul Hadi,Global (Check my services) | Lead Business Analyst | Presales | Content & Tech writer | Agile Product management | Data integration & Governance | Entrepreneur | Managed Service & Building teams | Remote-Experienced,https://www.linkedin.com/feed/update/urn:li:activity:7369227868972691457?commentUrn=urn%3Ali%3Acomment%3A%28activity%3A7369227868972691457%2C7369269397745528833%29&dashCommentUrn=urn%3Ali%3Afsd_comment%3A%287369269397745528833%2Curn%3Ali%3Aactivity%3A7369227868972691457%29,0,0,0.014583333333333337,0.0
7369269441869656064,"Hello Tareq, thanks for asking ! Have a look at Ecole 42 founded by Xavier Niel, Free's telco founder. I like their program and method (pragmatic and peer to peer). It is inclusive and has had great results so far. From my own experience teaching Digital Transformation to business school students here in France, or training teams and clients, I would say it is important to build 1) well rounded talents beyond AI eg a well thought core course (incl. cybersec, AI ethics etc). Ethics and gouvernance should be a key component 2) be very practical and team/ network oriented (peer to peer and team cases, internships). The best AI projects i have worked on where those with a bunch of specialists working well together. 3) the best teachers make the best students",5,ai / academy / real,Fouad Jaabouki,"Strategy | Transformation | Digital, Data, AI | Founder & CEO | Ex. Roland Berger, Apax Partners",https://www.linkedin.com/feed/update/urn:li:activity:7369227868972691457?commentUrn=urn%3Ali%3Acomment%3A%28activity%3A7369227868972691457%2C7369269441869656064%29&dashCommentUrn=urn%3Ali%3Afsd_comment%3A%287369269441869656064%2Curn%3Ali%3Aactivity%3A7369227868972691457%29,0,0,0.4791666666666667,0.0
7369269750666809345,"This is an excellent initiative. I believe the key focus areas should be on real AI tools connected to real business use cases, and I strongly recommend to close the skills gap left by traditional courses. For the AI learning path, I believe a structured learning paths from beginner to advanced with applied projects that demonstrate real impact",7,ai / real / training,Abdulwahab Alsharif,Finance & Accounting Professional | Digital Transformation Leader | MBA Candidate – Project Management,https://www.linkedin.com/feed/update/urn:li:activity:7369227868972691457?commentUrn=urn%3Ali%3Acomment%3A%28activity%3A7369227868972691457%2C7369269750666809345%29&dashCommentUrn=urn%3Ali%3Afsd_comment%3A%287369269750666809345%2Curn%3Ali%3Aactivity%3A7369227868972691457%29,0,0,0.27037037037037037,0.0
7369270271037374464,"A nice initiative, Tareq Amin, which I fully support. I believe a successful AI academy should include the following elements: – A social platform that democratizes AI education and connects universities, companies, and lifelong learners. – A course marketplace where anyone can be both a teacher and a learner. This is the core idea of our CourseMapper platform (https://coursemapper.de), where anyone can offer or register for courses. – The opportunity to collaborate across institutions on interdisciplinary real-world projects. – Flexible curricula with microcredentials that can be credited/recognized toward a university degree.",4,ai / tareq / tareq amin,Mohamed Amine Chatti,Professor of Computer Science at University of Duisburg-Essen | All opinions are mine,https://www.linkedin.com/feed/update/urn:li:activity:7369227868972691457?commentUrn=urn%3Ali%3Acomment%3A%28activity%3A7369227868972691457%2C7369270271037374464%29&dashCommentUrn=urn%3Ali%3Afsd_comment%3A%287369270271037374464%2Curn%3Ali%3Aactivity%3A7369227868972691457%29,0,0,0.2566666666666667,0.0
7369271781523689472,"Tareq Amin A fantastic vision for HUMAIN , shifting AI training from theory to practice is exactly what’s needed. I’d suggest focusing on three areas: solving real business problems with local datasets, blending technical skills with domain-specific applications, and embedding often-missing elements like prompt engineering and ethical deployment. An ideal path would progress from foundations to tools, then real industry projects and deployment at scale. As a professional in Riyadh, I’d be glad if these were communicated across all major regional firms and PIF companies so they can share industry perspectives to help shape an academy that delivers impact for both talent and employers. That said, deployment with a similarly structured strategy but for universities and other relevant academics organised in possibly tiered age groups.",8,ai / saudi / humain,Darren Chan,"Director, Development and Design | New Murabba Development Company, a PIF Company | Real Estate Developer | Registered Architect (UK), RIBA, ARB | International Award Winner | Giga Project Leadership | Design Executive",https://www.linkedin.com/feed/update/urn:li:activity:7369227868972691457?commentUrn=urn%3Ali%3Acomment%3A%28activity%3A7369227868972691457%2C7369271781523689472%29&dashCommentUrn=urn%3Ali%3Afsd_comment%3A%287369271781523689472%2Curn%3Ali%3Aactivity%3A7369227868972691457%29,0,0,0.20583333333333337,0.0
7369273826574028802,"There are a few levels of how the academy can approach it. Let's start with what (probably) is not needed: - super technical deep dive into how LLMs work and how to build one - MBA type of blah blah about digital transformation and how corps need to adopt AI On the other, this is what I feel the market needs: 1) Businesses (and primarily the SMEs /startups that are growing so quickly in Saudi) to know how to adopt AI in the most practical way in various functions, appropriate to their size. I.e.not how banks implement their custom built LLMs but how the local restaurant chain or travel agency can benefit from it 2) It's what's skills are lacking in the market. For both Saudi companies but also international companies coming to the market (to make sure they first use local talent before bringing people from abroad). This will perhaps have different levels. First - basic literacy; as everyone learned to use internet, there's benefit if everyone learns to use Humain or chatgpt for basic daily tasks. Then more role specific to teach how to use Ai for different roles at daily work. There's probably more but it's already a very lonng comment 😊",6,ai / saudi / real,Lukas Krejca,"Growth, Automation, AI | Exciting Experiences @ Ithara.ae",https://www.linkedin.com/feed/update/urn:li:activity:7369227868972691457?commentUrn=urn%3Ali%3Acomment%3A%28activity%3A7369227868972691457%2C7369273826574028802%29&dashCommentUrn=urn%3Ali%3Afsd_comment%3A%287369273826574028802%2Curn%3Ali%3Aactivity%3A7369227868972691457%29,0,0,0.14598765432098768,0.0
