id,text,theme_id,theme,author,author_title,comment_url,likes,replies,sentiment,idea_strength_seed
7369275032214102016,"The Academy is a brilliant initiative. Currently, AI learning resources are either overly technical or too broad, and there is a lack of material tailored to specific industries or domains. I believe the learning path should begin with a solid foundation in AI fundamentals, followed by more specialized sessions. Collaborating with pioneers and leaders from various industries would be great for understanding how AI is being utilized in the market.",7,ai / real / training,Zaid Saifi,Ops Strategy @ Meituan (Keeta) | Project Management & Negotiation | KSA & GCC Markets Launch | Cost Optimization,https://www.linkedin.com/feed/update/urn:li:activity:7369227868972691457?commentUrn=urn%3Ali%3Acomment%3A%28activity%3A7369227868972691457%2C7369275032214102016%29&dashCommentUrn=urn%3Ali%3Afsd_comment%3A%287369275032214102016%2Curn%3Ali%3Aactivity%3A7369227868972691457%29,0,0,0.2513888888888889,0.0
7369275162405335040,"I believe support should also be extended to private businesses by giving them the tools and training needed to empower their employees. The best AI training starts by helping employees apply AI in their daily job functions with clear objectives tied to their specific roles. For example: HR professionals using AI for recruitment, organizational development, and process re-engineering. Finance teams leveraging AI for anti-fraud detection and risk management. Operations teams applying AI for operational excellence, such as predictive maintenance and workflow optimization. This way, AI training becomes practical, targeted, and immediately valuable for both employees and organizations.",7,ai / real / training,Khalid Alqahtani,"Chief Executive Officer at IPS L.L.C | Leading the Largest Value-Added Distributor of Audio, Video, and Control Systems in MENA",https://www.linkedin.com/feed/update/urn:li:activity:7369227868972691457?commentUrn=urn%3Ali%3Acomment%3A%28activity%3A7369227868972691457%2C7369275162405335040%29&dashCommentUrn=urn%3Ali%3Afsd_comment%3A%287369275162405335040%2Curn%3Ali%3Aactivity%3A7369227868972691457%29,0,0,0.18333333333333335,0.0
7369275879367110657,"1. Focus Areas I think the priority should be on applied generative AI, actually fine-tuning models and building things like RAG systems, not just theory. MLOps is another big one, since deploying, monitoring, and scaling AI in real environments is where most people struggle. And finally, it would be valuable to design domain-specific tracks for key Saudi industries like energy, logistics, and finance. 2. What’s missing Most programs stop short of teaching the “last mile”; how to get models into production. There’s also a lack of training with real-world, messy datasets, since most examples are too clean and academic. And I’d love to see more focus on business translation, helping people connect AI projects directly to business goals and RoI. 3. Ideal Learning Path In my view, the best path would start with a short foundation, then move into specialized tracks (like engineer or architect), and end with a capstone project done with an industry partner with a market deployment and GTM in mind. That way, learners graduate with something real they’ve built and deployed.",6,ai / saudi / real,Abdulaziz AlBatli,General Manager | Cloud Aficionado | Market Developer | Policy & Regulation,https://www.linkedin.com/feed/update/urn:li:activity:7369227868972691457?commentUrn=urn%3Ali%3Acomment%3A%28activity%3A7369227868972691457%2C7369275879367110657%29&dashCommentUrn=urn%3Ali%3Afsd_comment%3A%287369275879367110657%2Curn%3Ali%3Aactivity%3A7369227868972691457%29,0,0,0.23174603174603176,0.0
7369275989710774273,"Great initiative Tareq Amin, hitting the core to take AI learning to the next level. Nowadays, most educators and institutions focus primarily on AI technology and its surrounding ecosystem, often neglecting the concept that inspire AI, which is cognitive science / neuroscience. In my opinion, this is where the focus should be.",4,ai / tareq / tareq amin,"Faisal Ammari, PhD",Audit & Assurance - Information Technology - Corporate Governance - Cyber Security - IT,https://www.linkedin.com/feed/update/urn:li:activity:7369227868972691457?commentUrn=urn%3Ali%3Acomment%3A%28activity%3A7369227868972691457%2C7369275989710774273%29&dashCommentUrn=urn%3Ali%3Afsd_comment%3A%287369275989710774273%2Curn%3Ali%3Aactivity%3A7369227868972691457%29,0,0,0.42500000000000004,0.0
7369276778021863425,"This is a great initiative to build AI talent in Saudi Arabia. My suggestion is to focus on project-based AI training. The programs should cover Machine Learning, Generative AI, and Agentic AI, with hands-on projects that solve real-world problems instead of only simple exercises. One key gap in many AI trainings today is the deployment aspect—either the focus is too theoretical, or the projects are too easy and not applicable in practice. Including end-to-end workflows from building to deploying AI solutions will make the learning much more impactful and industry-relevant.",6,ai / saudi / real,Suleman Ashraf,Data Science | Machine Learning Expert | GenAI | LLM | AWS | Azure | GCP,https://www.linkedin.com/feed/update/urn:li:activity:7369227868972691457?commentUrn=urn%3Ali%3Acomment%3A%28activity%3A7369227868972691457%2C7369276778021863425%29&dashCommentUrn=urn%3Ali%3Afsd_comment%3A%287369276778021863425%2Curn%3Ali%3Aactivity%3A7369227868972691457%29,0,0,0.2791666666666667,0.0
7369277573240877059,Salam w Alaykum We're the leading tech bootcamp in Morocco. We share the exact same vision ... we built and are currently running 90% hands-on (0% BS) bootcamps in Ai Engineering & Agentic Workflows. Happy to share our experience with you and how we built it with experts and practitioners like Younès. Let's connect. Salam.,8,ai / saudi / humain,Hamza DEBBARH,"EdTech Founder & CEO | Building Ark-x, a Talent-Centric Ecosystem (Tech + MENA) | Expertise in #futureofwork #futureoflearning #youthemployment #leapfrog",https://www.linkedin.com/feed/update/urn:li:activity:7369227868972691457?commentUrn=urn%3Ali%3Acomment%3A%28activity%3A7369227868972691457%2C7369277573240877059%29&dashCommentUrn=urn%3Ali%3Afsd_comment%3A%287369277573240877059%2Curn%3Ali%3Aactivity%3A7369227868972691457%29,0,0,0.2625,0.0
7369277980889624576,"Democratization of AI by Humain is a very good move. I suggest to focus on the agentic part of AI as the world is moving towards automation, Agents and humanoids.",0,ai / training / humain,Tariq Jamal,Data Scientist | AI/ML Engineer | Agentic AI | Automation & Workflow Specialist,https://www.linkedin.com/feed/update/urn:li:activity:7369227868972691457?commentUrn=urn%3Ali%3Acomment%3A%28activity%3A7369227868972691457%2C7369277980889624576%29&dashCommentUrn=urn%3Ali%3Afsd_comment%3A%287369277980889624576%2Curn%3Ali%3Aactivity%3A7369227868972691457%29,0,0,0.9099999999999999,0.0
7369278509015412736,"Tareq Amin This is a promising initiative. One sector that should not be overlooked by Humain Academy is universities. As the largest “pre-job-market prep programs,” they play a key role in shaping future talent. However, university program curricula are often disconnected from labor market needs, and adapting to rapid digital change is slow., as many faculty still see AI as a threat rather than an enabling tool. To drive meaningful change, AI training for universities must redefine their role in preparing graduates for today’s and tomorrow’s job market. Two guiding values are key: First, alignment, using curriculum mapping to link courses to any pre-defined national qualification frameworks and employer-demanded skills. Second: integration, embedding AI across all courses across programs, not just electives. This approach produces more competitive programs and curricula that remain relevant. For faculty, buy-in comes from practical, immediate value. AI should be framed as a practical, empowering tool that saves time and boosts productivity in tasks like: course design, grading, research support, content creation, etc. I believe universities are a key sector for creating a large-scale impact with AI training.",5,ai / academy / real,Dr. Suad Alazzam,"Educational Consultant for NGOs & Educational Institutions | Specialist in Instructional Leadership, Change Management, Curriculum Design, Teacher Training & Strategic Consulting",https://www.linkedin.com/feed/update/urn:li:activity:7369227868972691457?commentUrn=urn%3Ali%3Acomment%3A%28activity%3A7369227868972691457%2C7369278509015412736%29&dashCommentUrn=urn%3Ali%3Afsd_comment%3A%287369278509015412736%2Curn%3Ali%3Aactivity%3A7369227868972691457%29,0,0,0.1576923076923077,0.0
7369279470387548160,"It is very important to not jump right into development and implementation training. Foundationally, a key aspect of the training should be that the student/ professional adopts a strategic lens. This will ensure one isn’t trigger happy with AI tools and understands how to build a well-sequenced digital roadmap that unlocks maximum value for any enterprise. Basically, a. how to recognise transformation pitfalls, avoid fragmented adoption, and build a sequenced roadmap, and b. how to evaluate investment choices with a clear lens on ROI, compliance, and risk. I have covered some of this in the following paper (written for CMOs): http://bit.ly/47sshZA",3,ai / training / skills,Satyam Chauhan,Global Marketing & Brand Leader | Ex-Shell (Fortune 10) | $25M+ Transformation Savings | Cannes Award-Winning Campaign | Employer Brand & Masterbrand Leadership | India & Middle East,https://www.linkedin.com/feed/update/urn:li:activity:7369227868972691457?commentUrn=urn%3Ali%3Acomment%3A%28activity%3A7369227868972691457%2C7369279470387548160%29&dashCommentUrn=urn%3Ali%3Afsd_comment%3A%287369279470387548160%2Curn%3Ali%3Aactivity%3A7369227868972691457%29,0,1,0.22571428571428573,2.7578571428571426
7369279483201134594,"1. Areas to focus: relevant examples are key. For instance when training financial analysts focus on retrieving data from financial filings for deeper analysis, when its lawyers then focus on laws and regulations. Main issue with tutorials is giving abstract examples like booking an airline ticket. 2. What’s missing is a lack of “video gamer” mindset. This means a tutorial must first deliver that aha moment immediately by getting users to run a program fast so they can play with it. And only then start breaking down the concepts needed to build it. I ran a course like this recently. Link below. 3. Ideal learning path for knowledge workers should start from the most fun things which in my mind is just getting a GitHub repo to run. Trouble shooting is vastly more relevant for new users than core programming. Once they know how to immediately apply what they’ve learned, then the fly wheel begins. I ran a course like this in Karachi recently. Wish you the best with Humain! https://www.linkedin.com/posts/cfa-society-pakistan_heres-what-our-participants-had-to-say-about-activity-7359576824558804994-ZvBY?utm_medium=ios_app&rcm=ACoAAAB1UO0ByQQLkf_QnBLyFBY6Jbi9jiilJxA&utm_source=social_share_send&utm_campaign=copy_link",3,ai / training / skills,Isfandiyar Shaheen,Context retriever 🦮,https://www.linkedin.com/feed/update/urn:li:activity:7369227868972691457?commentUrn=urn%3Ali%3Acomment%3A%28activity%3A7369227868972691457%2C7369279483201134594%29&dashCommentUrn=urn%3Ali%3Afsd_comment%3A%287369279483201134594%2Curn%3Ali%3Aactivity%3A7369227868972691457%29,0,0,0.23797498797498792,0.0
7369279995803856897,"1. Practical Skills Development**: Prioritize hands-on training with real AI tools to ensure immediate applicability. 2. Integration of Theory and Practice**: Design programs that seamlessly connect academic concepts with industry needs. 3. Collaborative Learning Environments**: Foster partnerships between students, professionals, and businesses to enhance learning. 4. Customized Learning Journeys**: Tailor educational paths to align with individual career objectives and market demands. 5. Strategic Industry Partnerships**: Collaborate with leading companies to ensure curriculum relevance and facilitate job placements. 6. Dynamic Curriculum Updates**: Regularly refresh content to keep pace with emerging technologies and trends. 7. Community Engagement**: Build a robust network for ongoing support and collaboration among learners and industry leaders. 8. Ethical Considerations**: Incorporate discussions on the ethical implications of AI and its impact on society. 9. Continuous Improvement**: Establish a feedback mechanism to iteratively refine programs based on stakeholder input.",3,ai / training / skills,Mohammed A.,"Expert ,Enterprise Architecture | IT Planning & Management |TOGAF® | Prosci® | BPM",https://www.linkedin.com/feed/update/urn:li:activity:7369227868972691457?commentUrn=urn%3Ali%3Acomment%3A%28activity%3A7369227868972691457%2C7369279995803856897%29&dashCommentUrn=urn%3Ali%3Afsd_comment%3A%287369279995803856897%2Curn%3Ali%3Aactivity%3A7369227868972691457%29,0,0,0.10555555555555556,0.0
7369281386685448193,"You are spot on Tareq Amin, this is definitely the way to go. You should contact The AI Social Club and join forces!",2,ai / tareq / amin,Audrey L.,AI advisor and executive training partner | Transformation | Operations | Strategy | Product | (ex-Checkout),https://www.linkedin.com/feed/update/urn:li:activity:7369227868972691457?commentUrn=urn%3Ali%3Acomment%3A%28activity%3A7369227868972691457%2C7369281386685448193%29&dashCommentUrn=urn%3Ali%3Afsd_comment%3A%287369281386685448193%2Curn%3Ali%3Aactivity%3A7369227868972691457%29,0,0,0.020833333333333332,0.0
7369281830023278593,"I run an online course called AI LABS. 11 months, 1200+ learners from 15 countries. I teach in Hindi (English and other languages soon). Overtime, 3 gaps in AI learning have emerged: 1. How to create well structured data and data-patterns? 2. How to write great quality prompts to make AI dive deep? 3. How to inspire people to learn on their own (Study and Learn) - step by step? Unless people realise that - AI - is their 1on1 - hyper-personalised tutor already, they will keep randomly taking on online courses and build nothing. HUMAIN community should be able to shape the future of humanity with AI.",0,ai / training / humain,Paritosh Sharma 🇮🇳  (Shunya AI Certified),Building - Shunya AI,https://www.linkedin.com/feed/update/urn:li:activity:7369227868972691457?commentUrn=urn%3Ali%3Acomment%3A%28activity%3A7369227868972691457%2C7369281830023278593%29&dashCommentUrn=urn%3Ali%3Afsd_comment%3A%287369281830023278593%2Curn%3Ali%3Aactivity%3A7369227868972691457%29,0,0,0.159375,0.0
7369282368337047553,"Hi Tareq, some ideas: What areas do you believe we should focus on most? - Strategic AI Implementation: theory to deployment and scaling in KSA - AI Leadership: Change management, tech communication, AI-ready culture - Generative AI: hands-on experience, prompt engineering, business applications - Human-AI Collaboration: intelligent workflows that amplify capabilities - Risk & Compliance: cybersecurity, regulatory frameworks, ethical AI What's missing from AI training today that HUMAIN Academy can solve? The regional context gap. Current programs miss: - Data Sovereignty: Saudi regulations and cultural sensitivities - Infrastructure: Practical compute solutions in region - Vision 2030: AI for energy, tourism, manufacturing, finance - Arabic AI: NLP and culturally relevant applications If you had to design your ideal AI learning path, what would it look like? Hybrid program: Riyadh intensives with online sessions. Building a network of Saudi AI practitioners would be the key highlight. Much needed initiative. Best of luck!",4,ai / tareq / tareq amin,Jesse Desjardins,"Global Brand Strategist | Marketing Strategy, Brand & Large Scale Campaign Development",https://www.linkedin.com/feed/update/urn:li:activity:7369227868972691457?commentUrn=urn%3Ali%3Acomment%3A%28activity%3A7369227868972691457%2C7369282368337047553%29&dashCommentUrn=urn%3Ali%3Afsd_comment%3A%287369282368337047553%2Curn%3Ali%3Aactivity%3A7369227868972691457%29,0,0,0.35454545454545455,0.0
7369282677180477440,"1. Customer needs should guide the development of the academy. 2. Sure arabic will be the center of focus. 3. Visuals, videos and movies should be a big part of this. 4. Real challenges and problems (arab world is full of challenges and opportunities) to solve will make outcomes stronger than typical courses. 5. Theory is still essential for certain courses—especially AI science—and should feed a robust R&D pipeline.",8,ai / saudi / humain,Mohammad Bahloul,Product Lead | Strategist | Digital Transformation | Building the best in class products for customers in telecom domain | Follow me for posts about Product Management & Leadership,https://www.linkedin.com/feed/update/urn:li:activity:7369227868972691457?commentUrn=urn%3Ali%3Acomment%3A%28activity%3A7369227868972691457%2C7369282677180477440%29&dashCommentUrn=urn%3Ali%3Afsd_comment%3A%287369282677180477440%2Curn%3Ali%3Aactivity%3A7369227868972691457%29,0,0,0.12470238095238097,0.0
7369284306235555840,"I look at it in two aspects - #1. Empower people with knolwedge and fundamentals- people decides and selects the AI tools. #2. educate people to work with AI interface. 1. Foundational Strategy & Collaboration - Establish a Tripartite Alliance: Success depends on a deep, sustainable partnership between Industry, Government, and Academia. This ensures long-term vision and shared goals. - Adopt a ""Shift Left"" Philosophy: Focus on strengthening the fundamentals first. Build a strong base of knowledge and talent before rushing to high-level applications. This creates innovators, not just users. 2. Talent Development & Education Pipeline - Strengthen Core Curriculum: Review and enhance the curriculum from school to university, focusing on core subjects like Mathematics, Logic, Core Science and fundamental Computer Science. - Prevent Cognitive Dependency: Design learning paths, especially for young students, that prioritize critical thinking and problem-solving skills over premature reliance on AI tools. This avoids creating a generation that can't innovate independently. Super Critical. 3. Building the Innovation Ecosystem: moat to sustain - Develop World-Class Institutions - Attract Global Talent - Sponsor Foundational Research",4,ai / tareq / tareq amin,Jawed A,"Director, R&D | GenAI & SaaS Platform Strategist | Cloud Native Builder | Driving Innovation from Zero to One",https://www.linkedin.com/feed/update/urn:li:activity:7369227868972691457?commentUrn=urn%3Ali%3Acomment%3A%28activity%3A7369227868972691457%2C7369284306235555840%29&dashCommentUrn=urn%3Ali%3Afsd_comment%3A%287369284306235555840%2Curn%3Ali%3Aactivity%3A7369227868972691457%29,0,0,0.051388888888888894,0.0
7369284510493892609,"What a brilliant idea Tareq. I suggest the below: • Move beyond toy datasets and expose learners to real-world Saudi use cases (energy, healthcare, logistics, finance). • Partner with companies to provide datasets and live problem statements. • Teach how to work from concept → prototype → deployment → scaling. Most training stops at building models.",8,ai / saudi / humain,Awad Alwalah,"MSc IS, PhD (ongoing), Telecom eng. at Saudi Aramco, Data Center Management, IT Infrastructure",https://www.linkedin.com/feed/update/urn:li:activity:7369227868972691457?commentUrn=urn%3Ali%3Acomment%3A%28activity%3A7369227868972691457%2C7369284510493892609%29&dashCommentUrn=urn%3Ali%3Afsd_comment%3A%287369284510493892609%2Curn%3Ali%3Aactivity%3A7369227868972691457%29,0,0,0.5121212121212121,0.0
7369284969099116544,"You might want to connect with Margot Bletterie, founder of The AI Social Club, she’s developed tailored AI learning journeys for professionals from all industries, helping them get future-ready (execs, business teams, entrepreneurs,…). It's practical and fully bespoke, you should talk 🙂",0,ai / training / humain,Charline de Rouvroy,Project Manager - Nitidæ & Cashew Analyst - N'kalo,https://www.linkedin.com/feed/update/urn:li:activity:7369227868972691457?commentUrn=urn%3Ali%3Acomment%3A%28activity%3A7369227868972691457%2C7369284969099116544%29&dashCommentUrn=urn%3Ali%3Afsd_comment%3A%287369284969099116544%2Curn%3Ali%3Aactivity%3A7369227868972691457%29,0,1,0.06666666666666667,2.4000000000000004
7369285702783610881,"🇸🇦✨ The idea of the HUMAIN Academy is a pivotal step, especially if it focuses on the practical skills needed in today's market. In my opinion, the three most important pillars upon which the academy should be built are: 1️⃣ Learning by doing (real-life applied projects). 2️⃣ Connecting with companies to test solutions directly. 3️⃣ Business + technology skills combined (Business + AI). This combination is what creates a generation capable of not only learning, but also actually building solutions that serve Vision 2030. 🚀 #HUMAINAcademy #HUMAINAI #Vision2030",5,ai / academy / real,Saif Alruwaili,IT | Help Desk Technician | Network Administrator | Database,https://www.linkedin.com/feed/update/urn:li:activity:7369227868972691457?commentUrn=urn%3Ali%3Acomment%3A%28activity%3A7369227868972691457%2C7369285702783610881%29&dashCommentUrn=urn%3Ali%3Afsd_comment%3A%287369285702783610881%2Curn%3Ali%3Aactivity%3A7369227868972691457%29,0,0,0.2125,0.0
7369287801936171008,"""Great idea! I believe one of the biggest gaps in training is aligning the objectives with actual market needs and finding effective ways to measure that alignment. Additionally, courses should keep pace with the rapid changes in the AI industry. A good solution is to consistently hire industry professionals and ensure that instructors are practitioners with real-world experience, rather than solely academic or purely theoretical teachers.""",7,ai / real / training,"Rami N. Yaseen, MBA",Sales Manager @ LowRisk ME,https://www.linkedin.com/feed/update/urn:li:activity:7369227868972691457?commentUrn=urn%3Ali%3Acomment%3A%28activity%3A7369227868972691457%2C7369287801936171008%29&dashCommentUrn=urn%3Ali%3Afsd_comment%3A%287369287801936171008%2Curn%3Ali%3Aactivity%3A7369227868972691457%29,0,0,0.36428571428571427,0.0
7369289114539421696,"The AI potentials are obvious to both technicals and technicals, and throughout my career in healthcare whither as a physician or as a leader the potentials are becoming more and more prominent on both sides clinical and administrative. What I’ve noticed among people I worked with is the gap between the technologys’ concepts understanding and the actual utilization of the technology potentials. For this I would suggest a layered educational approach in which the knowledge and skills sets will be built layer by layer; upon a strong foundation and layered up to very specific industry use case. For example it can be: Foundational training Core skills training including the cybersecurity threats associated with the use of such technology And finally industry specific use case training The opportunity is huge and the gap is growing with every advancement. Tareq Amin I really appreciate the opportunity to discuss such an important topic and I’ll be more than happy to discuss further to help build something that helps people especially within healthcare industry.",7,ai / real / training,Bashar A.,AI & Health Informatics | Medical Coding & Interoperability | Healthcare Augmented Intelligence | Healthcare Economics | Leadership,https://www.linkedin.com/feed/update/urn:li:activity:7369227868972691457?commentUrn=urn%3Ali%3Acomment%3A%28activity%3A7369227868972691457%2C7369289114539421696%29&dashCommentUrn=urn%3Ali%3Afsd_comment%3A%287369289114539421696%2Curn%3Ali%3Aactivity%3A7369227868972691457%29,0,0,0.24666666666666665,0.0
7369290809705181185,"Great initiative Tareq Amin and I can see a lot of great ideas already. In my view, you should make the Academy a ""living lab"", whereby the curriculum prioritizes at its heart (and part of its unique proposition), the exposure of students to the real-life problems that HUMAIN is solving using AI (across national priority sectors and use cases), and gives them the opportunity to be involved in solving those problems, rather than acquiring textbook concepts that have been commoditized.",5,ai / academy / real,Ahmad R. Dhaini,Strategy Consulting | Digital | Innovation | Entrepreneurship | Economic Development,https://www.linkedin.com/feed/update/urn:li:activity:7369227868972691457?commentUrn=urn%3Ali%3Acomment%3A%28activity%3A7369227868972691457%2C7369290809705181185%29&dashCommentUrn=urn%3Ali%3Afsd_comment%3A%287369290809705181185%2Curn%3Ali%3Aactivity%3A7369227868972691457%29,0,0,0.6583333333333333,0.0
